name,demand,capacity,latency,risk,weight,score,decision,reason
baseline,59,84,16,15,7,136,review,cli tools baseline scenario exercises the review path for bounded failure handling
pressure,79,73,29,22,11,122,review,cli tools pressure scenario exercises the review path for bounded failure handling
surge,99,94,22,15,11,232,accept,cli tools surge scenario keeps the local fixture within the modeled acceptance band
degraded,72,60,32,26,8,52,review,cli tools degraded scenario exercises the review path for bounded failure handling
recovery,93,102,18,10,10,254,accept,cli tools recovery scenario keeps the local fixture within the modeled acceptance band
boundary,76,78,26,16,7,130,review,cli tools boundary scenario exercises the review path for bounded failure handling
